<?xml version="1.0" encoding="UTF-8"?>
<book xmlns:xsi="http://www.w3.org/2001/XMLSchema-instance" xsi:noNamespaceSchemaLocation="nested.xsd">
<isbn>string</isbn>
  <title>token</title>
  <author>token</author>
  <!--1 or more repetitions:-->
  <publisher>token</publisher>
  <page_number>3</page_number>
  <!--Optional:-->
  <description>string</description>
  <!--choise of the next 2 items at this level-->
  <papper>anyType</papper>
  <!--other>anyType</other-->
</book>
